85,https://oeil.europarl.europa.eu/oeil/en/procedure-file?reference=2025/0096(COD),2025/0096(COD),Registration documents for vehicles. 'Roadworthiness package',"3.20.06 Transport regulations, road safety, roadworthiness tests, driving licence","{'European Parliament': [{'Committee responsible': 'TRAN Transport and Tourism', 'Rapporteur': 'DANIELSSON Johan (S&D)', 'Appointed': '07/07/2025', 'Shadow rapporteurs': ['MEHNERT Alexandra (EPP)', 'LEONARDELLI Julien (PfE)', 'AXINIA Adrian-George (ECR)', 'CHRISTENSEN Asger (Renew)', 'METZ Tilly (Greens/EFA)', 'KOUNTOURA Elena (The Left)']}, {'Committee for opinion': 'IMCO Internal Market and Consumer Protection', 'Rapporteur for opinion': 'DOSTALOVA Klara (PfE)', 'Appointed': '07/10/2025'}], 'Council of the European Union': [], 'European Commission': [{'Commission DG': 'Mobility and Transport', 'Commissioner': 'TZITZIKOSTAS Apostolos'}], 'European Economic and Social Committee': [], 'European Committee of the Regions': []}","{'24/04/2025': [{'Date': '24/04/2025', 'Event': 'Legislative proposal published', 'Reference': [{'text': 'COM(2025)0179', 'href': 'https://www.europarl.europa.eu/RegData/docs_autres_institutions/commission_europeenne/com/2025/0179/COM_COM(2025)0179_EN.pdf'}, {'text': '', 'href': 'https://eur-lex.europa.eu/smartapi/cgi/sga_doc?smartapi!celexplus!prod!DocNumber&lg=EN&type_doc=COMfinal&an_doc=2025&nu_doc=0179'}], 'Summary': [{'text': 'Summary', 'href': '/oeil/en/document-summary?id=1811126'}]}], '10/07/2025': [{'Date': '10/07/2025', 'Event': 'Committee referral announced in Parliament, 1st reading', 'Reference': '', 'Summary': ''}]}","[{'Institution': 'European Commission', 'Document type': 'Legislative proposal', 'Reference': ""{'text': 'COM(2025)0179', 'href': 'https://www.europarl.europa.eu/RegData/docs_autres_institutions/commission_europeenne/com/2025/0179/COM_COM(2025)0179_EN.pdf'}, {'text': '', 'href': 'https://eur-lex.europa.eu/smartapi/cgi/sga_doc?smartapi!celexplus!prod!DocNumber&lg=EN&type_doc=COMfinal&an_doc=2025&nu_doc=0179'}"", 'Date': '24/04/2025', 'Summary': ""{'text': 'Summary', 'href': '/oeil/en/document-summary?id=1811126'}""}, {'Institution': 'European Commission', 'Document type': 'Document attached to the procedure', 'Reference': 'SEC(2025)0119', 'Date': '24/04/2025', 'Summary': ''}, {'Institution': 'European Commission', 'Document type': 'Document attached to the procedure', 'Reference': ""{'text': '', 'href': 'https://eur-lex.europa.eu/LexUriServ/LexUriServ.do?uri=SWD:2025:0096:FIN:EN:PDF'}"", 'Date': '24/04/2025', 'Summary': ''}, {'Institution': 'European Commission', 'Document type': 'Document attached to the procedure', 'Reference': ""{'text': '', 'href': 'https://eur-lex.europa.eu/LexUriServ/LexUriServ.do?uri=SWD:2025:0097:FIN:EN:PDF'}"", 'Date': '24/04/2025', 'Summary': ''}, {'Institution': 'European Commission', 'Document type': 'Document attached to the procedure', 'Reference': ""{'text': '', 'href': 'https://eur-lex.europa.eu/LexUriServ/LexUriServ.do?uri=SWD:2025:0098:FIN:EN:PDF'}"", 'Date': '24/04/2025', 'Summary': ''}, {'Institution': 'European Commission', 'Document type': 'Document attached to the procedure', 'Reference': ""{'text': '', 'href': 'https://eur-lex.europa.eu/LexUriServ/LexUriServ.do?uri=SWD:2025:0099:FIN:EN:PDF'}"", 'Date': '24/04/2025', 'Summary': ''}, {'Institution': 'National parliaments', 'Document type': 'Contribution', 'Parliament/Chamber': 'RO_SENATE', 'Reference': ""{'text': 'COM(2025)0179', 'href': 'https://connectfolx.europarl.europa.eu/connefof/app/exp/COM(2025)0179'}"", 'Date': '04/07/2025', 'Summary': ''}, {'Institution': 'National parliaments', 'Document type': 'Contribution', 'Parliament/Chamber': 'CZ_SENATE', 'Reference': ""{'text': 'COM(2025)0179', 'href': 'https://connectfolx.europarl.europa.eu/connefof/app/exp/COM(2025)0179'}"", 'Date': '09/07/2025', 'Summary': ''}, {'Institution': 'National parliaments', 'Document type': 'Contribution', 'Parliament/Chamber': 'IT_CHAMBER', 'Reference': ""{'text': 'COM(2025)0179', 'href': 'https://connectfolx.europarl.europa.eu/connefof/app/exp/COM(2025)0179'}"", 'Date': '14/07/2025', 'Summary': ''}, {'Institution': 'National parliaments', 'Document type': 'Contribution', 'Parliament/Chamber': 'IT_SENATE', 'Reference': ""{'text': 'COM(2025)0179', 'href': 'https://connectfolx.europarl.europa.eu/connefof/app/exp/COM(2025)0179'}"", 'Date': '04/08/2025', 'Summary': ''}, {'Institution': 'Other institutions and bodies', 'Institution/body': 'EESC', 'Document type': 'Economic and Social Committee: opinion, report', 'Reference': ""{'text': 'CES1216/2025', 'href': 'https://dmsearch.eesc.europa.eu/search/public?k=(documenttype:AC)(documentnumber:1216)(documentyear:2025)(documentlanguage:EN)'}"", 'Date': '18/09/2025', 'Summary': ''}, {'Institution': 'National parliaments', 'Document type': 'Contribution', 'Parliament/Chamber': 'FR_SENATE', 'Reference': ""{'text': 'COM(2025)0179', 'href': 'https://connectfolx.europarl.europa.eu/connefof/app/exp/COM(2025)0179'}"", 'Date': '27/11/2025', 'Summary': ''}, {'Institution': 'European Parliament', 'Document type': 'Committee draft report', 'Committee': '', 'Reference': ""{'text': 'PE779.822', 'href': 'https://www.europarl.europa.eu/doceo/document/TRAN-PR-779822_EN.html'}"", 'Date': '03/12/2025', 'Summary': ''}]","{'Rapporteurs, Shadow Rapporteurs and Committee Chairs': [{'Name': [{'text': 'DANIELSSON Johan', 'href': 'https://www.europarl.europa.eu/meps/en/38542'}], 'Role': 'Rapporteur', 'Committee': [{'text': 'TRAN', 'href': 'https://www.europarl.europa.eu/committes/en/TRAN'}], 'Date': '10/12/2025', 'Interest representatives': ""European Transport Workers' Federation""}, {'Name': [{'text': 'DANIELSSON Johan', 'href': 'https://www.europarl.europa.eu/meps/en/38542'}], 'Role': 'Rapporteur', 'Committee': [{'text': 'TRAN', 'href': 'https://www.europarl.europa.eu/committes/en/TRAN'}], 'Date': '14/11/2025', 'Interest representatives': 'OPUS GROUP AB'}, {'Name': [{'text': 'DANIELSSON Johan', 'href': 'https://www.europarl.europa.eu/meps/en/38542'}], 'Role': 'Rapporteur', 'Committee': [{'text': 'TRAN', 'href': 'https://www.europarl.europa.eu/committes/en/TRAN'}], 'Date': '11/11/2025', 'Interest representatives': 'ACEA'}, {'Name': [{'text': 'DANIELSSON Johan', 'href': 'https://www.europarl.europa.eu/meps/en/38542'}], 'Role': 'Rapporteur', 'Committee': [{'text': 'TRAN', 'href': 'https://www.europarl.europa.eu/committes/en/TRAN'}], 'Date': '23/10/2025', 'Interest representatives': 'Swedish Federation of Historic Vehicles'}, {'Name': [{'text': 'KALFON François', 'href': 'https://www.europarl.europa.eu/meps/en/256908'}], 'Role': 'Shadow rapporteur for opinion', 'Committee': [{'text': 'IMCO', 'href': 'https://www.europarl.europa.eu/committes/en/IMCO'}], 'Date': '17/10/2025', 'Interest representatives': 'OPUS GROUP AB'}, {'Name': [{'text': 'MEHNERT Alexandra', 'href': 'https://www.europarl.europa.eu/meps/en/256980'}], 'Role': 'Shadow rapporteur', 'Committee': [{'text': 'TRAN', 'href': 'https://www.europarl.europa.eu/committes/en/TRAN'}], 'Date': '16/10/2025', 'Interest representatives': 'Allgemeiner Deutscher Automobil-Club e.V.'}, {'Name': [{'text': 'MEHNERT Alexandra', 'href': 'https://www.europarl.europa.eu/meps/en/256980'}], 'Role': 'Shadow rapporteur', 'Committee': [{'text': 'TRAN', 'href': 'https://www.europarl.europa.eu/committes/en/TRAN'}], 'Date': '16/10/2025', 'Interest representatives': 'European Transport Safety Council'}, {'Name': [{'text': 'DANIELSSON Johan', 'href': 'https://www.europarl.europa.eu/meps/en/38542'}], 'Role': 'Rapporteur', 'Committee': [{'text': 'TRAN', 'href': 'https://www.europarl.europa.eu/committes/en/TRAN'}], 'Date': '15/10/2025', 'Interest representatives': 'ETSC'}, {'Name': [{'text': 'MEHNERT Alexandra', 'href': 'https://www.europarl.europa.eu/meps/en/256980'}], 'Role': 'Shadow rapporteur', 'Committee': [{'text': 'TRAN', 'href': 'https://www.europarl.europa.eu/committes/en/TRAN'}], 'Date': '15/10/2025', 'Interest representatives': ""Association des Constructeurs Européens d'Automobiles""}, {'Name': [{'text': 'TOMAŠIČ Zala', 'href': 'https://www.europarl.europa.eu/meps/en/256814'}], 'Role': 'Shadow rapporteur for opinion', 'Committee': [{'text': 'IMCO', 'href': 'https://www.europarl.europa.eu/committes/en/IMCO'}], 'Date': '08/10/2025', 'Interest representatives': 'Enterprise Rent-A-Car UK Limited'}], 'Other Members': [{'Name': [{'text': 'GIESEKE Jens', 'href': 'https://www.europarl.europa.eu/meps/en/124807'}], 'Date': '15/07/2025', 'Interest representatives': 'Allgemeiner Deutscher Automobil-Club e.V.'}]}",,True,2025/0096(COD),COD - Ordinary legislative procedure (ex-codecision procedure),Legislation,Directive,"[{'text': 'Repealing Directive 1999/0037'}, {'text': '1997/0150(SYN)', 'href': '/oeil/en/procedure-file?reference=1997/0150(SYN)'}]",Treaty on the Functioning of the EU TFEU 091-p1 Treaty on the Functioning of the EU TFEU 294-p7-ac,Awaiting committee decision,TRAN/10/02753,"[{'text': 'European Economic and Social Committee', 'href': 'http://www.eesc.europa.eu/'}, {'text': 'European Committee of the Regions', 'href': 'http://www.cor.europa.eu/'}]",
86,https://oeil.europarl.europa.eu/oeil/en/procedure-file?reference=2025/0410(COD),2025/0410(COD),Simplification and strengthening of food and feed safety requirements,"2.80 Cooperation between administrations, 3.10.02 Processed products, agri-foodstuffs, 3.10.04.02 Animal protection, 3.10.08 Animal health requirements, veterinary legislation and pharmacy, 3.10.08.01 Feedingstuffs, animal nutrition, 3.10.09 Plant health legislation, organic farming, agro-genetics in general, 3.10.10 Foodstuffs, foodstuffs legislation, 4.60.04.04 Food safety, 8.70 Budget of the Union","{'European Parliament': [{'Committee responsible': 'Pending final decision', 'Rapporteur': 'Pending final decision', 'Appointed': 'Pending final decision'}, {'Committee for opinion': 'Pending final decision', 'Rapporteur for opinion': 'Pending final decision', 'Appointed': 'Pending final decision'}, {'Committee for budgetary assessment': 'Pending final decision', 'Rapporteur for budgetary assessment': 'Pending final decision', 'Appointed': 'Pending final decision'}], 'Council of the European Union': [], 'European Economic and Social Committee': [], 'European Committee of the Regions': []}","{'16/12/2025': [{'Date': '16/12/2025', 'Event': 'Legislative proposal published', 'Reference': [{'text': 'COM(2025)1030', 'href': 'https://www.europarl.europa.eu/RegData/docs_autres_institutions/commission_europeenne/com/2025/1030/COM_COM(2025)1030_EN.pdf'}], 'Summary': ''}]}","[{'Institution': 'European Commission', 'Document type': 'Legislative proposal', 'Reference': ""{'text': 'COM(2025)1030', 'href': 'https://www.europarl.europa.eu/RegData/docs_autres_institutions/commission_europeenne/com/2025/1030/COM_COM(2025)1030_EN.pdf'}"", 'Date': '16/12/2025', 'Summary': ''}, {'Institution': 'European Commission', 'Document type': 'Document attached to the procedure', 'Reference': ""{'text': '', 'href': 'https://eur-lex.europa.eu/LexUriServ/LexUriServ.do?uri=SWD:2025:1030:FIN:EN:PDF'}"", 'Date': '17/12/2025', 'Summary': ''}]",,,True,2025/0410(COD),COD - Ordinary legislative procedure (ex-codecision procedure),Legislation,Regulation,"[{'text': 'Amending Regulation 2001/0999'}, {'text': '1998/0323(COD)', 'href': '/oeil/en/procedure-file?reference=1998/0323(COD)'}, {'text': 'Amending Regulation 2004/0852'}, {'text': '2000/0178(COD)', 'href': '/oeil/en/procedure-file?reference=2000/0178(COD)'}, {'text': 'Amending Regulation 2004/853'}, {'text': '2000/0179(COD)', 'href': '/oeil/en/procedure-file?reference=2000/0179(COD)'}, {'text': 'Amending Regulation 2003/1829'}, {'text': '2001/0173(COD)', 'href': '/oeil/en/procedure-file?reference=2001/0173(COD)'}, {'text': 'Amending Regulation 2003/1831'}, {'text': '2002/0073(COD)', 'href': '/oeil/en/procedure-file?reference=2002/0073(COD)'}, {'text': 'Amending Regulation 2005/396'}, {'text': '2003/0052(COD)', 'href': '/oeil/en/procedure-file?reference=2003/0052(COD)'}, {'text': 'Amending Regulation 2009/1107'}, {'text': '2006/0136(COD)', 'href': '/oeil/en/procedure-file?reference=2006/0136(COD)'}, {'text': 'Amending Regulation 2009/1099'}, {'text': '2008/0180(CNS)', 'href': '/oeil/en/procedure-file?reference=2008/0180(CNS)'}, {'text': 'Amending Regulation 2012/ 528'}, {'text': '2009/0076(COD)', 'href': '/oeil/en/procedure-file?reference=2009/0076(COD)'}, {'text': 'Amending Regulation 2017/625'}, {'text': '2013/0140(COD)', 'href': '/oeil/en/procedure-file?reference=2013/0140(COD)'}]",Rules of Procedure EP 58 Treaty on the Functioning of the EU TFEU 168-p4 Treaty on the Functioning of the EU TFEU 192-p1 Treaty on the Functioning of the EU TFEU 114 Treaty on the Functioning of the EU TFEU 043-p2,Preparatory phase in Parliament,,"[{'text': 'European Economic and Social Committee', 'href': 'http://www.eesc.europa.eu/'}, {'text': 'European Committee of the Regions', 'href': 'http://www.cor.europa.eu/'}]",
87,https://oeil.europarl.europa.eu/oeil/en/procedure-file?reference=2025/0421(COD),2025/0421(COD),Clean corporate vehicles,"2.10.03 Standardisation, EC/EU standards and trade mark, certification, compliance, 3.20.05 Road transport: passengers and freight, 3.40.03 Motor industry, cycle and motorcycle, commercial and agricultural vehicles, 3.70.02 Atmospheric pollution, motor vehicle pollution","{'European Parliament': [{'Committee responsible': 'Pending final decision', 'Rapporteur': 'Pending final decision', 'Appointed': 'Pending final decision'}, {'Committee for opinion': 'Pending final decision', 'Rapporteur for opinion': 'Pending final decision', 'Appointed': 'Pending final decision'}], 'Council of the European Union': [], 'European Economic and Social Committee': [], 'European Committee of the Regions': []}","{'16/12/2025': [{'Date': '16/12/2025', 'Event': 'Legislative proposal published', 'Reference': [{'text': 'COM(2025)0994', 'href': 'https://www.europarl.europa.eu/RegData/docs_autres_institutions/commission_europeenne/com/2025/0994/COM_COM(2025)0994_EN.pdf'}], 'Summary': ''}]}","[{'Institution': 'European Commission', 'Document type': 'Legislative proposal', 'Reference': ""{'text': 'COM(2025)0994', 'href': 'https://www.europarl.europa.eu/RegData/docs_autres_institutions/commission_europeenne/com/2025/0994/COM_COM(2025)0994_EN.pdf'}"", 'Date': '16/12/2025', 'Summary': ''}, {'Institution': 'European Commission', 'Document type': 'Document attached to the procedure', 'Reference': 'SEC(2025)0994', 'Date': '17/12/2025', 'Summary': ''}, {'Institution': 'European Commission', 'Document type': 'Document attached to the procedure', 'Reference': ""{'text': '', 'href': 'https://eur-lex.europa.eu/LexUriServ/LexUriServ.do?uri=SWD:2025:1060:FIN:EN:PDF'}"", 'Date': '17/12/2025', 'Summary': ''}, {'Institution': 'European Commission', 'Document type': 'Document attached to the procedure', 'Reference': ""{'text': '', 'href': 'https://eur-lex.europa.eu/LexUriServ/LexUriServ.do?uri=SWD:2025:1061:FIN:EN:PDF'}"", 'Date': '17/12/2025', 'Summary': ''}]",,,True,2025/0421(COD),COD - Ordinary legislative procedure (ex-codecision procedure),Legislation,Regulation,,Treaty on the Functioning of the EU TFEU 192-p1,Preparatory phase in Parliament,,"[{'text': 'European Economic and Social Committee', 'href': 'http://www.eesc.europa.eu/'}, {'text': 'European Committee of the Regions', 'href': 'http://www.cor.europa.eu/'}]",
88,https://oeil.europarl.europa.eu/oeil/en/procedure-file?reference=2025/0190(COD),2025/0190(COD),European Union designs (codification),"8.40.01.08 Business of Parliament, procedure, sittings, rules of procedure","{'European Parliament': [{'Committee responsible': 'JURI Legal Affairs', 'Rapporteur': 'ADAMOWICZ Magdalena (EPP)', 'Appointed': '04/07/2025'}], 'Council of the European Union': [], 'European Commission': [{'Commission DG': 'Legal Service', 'Commissioner': ''}]}","{'03/07/2025': [{'Date': '03/07/2025', 'Event': 'Legislative proposal published', 'Reference': [{'text': 'COM(2025)0353', 'href': 'https://www.europarl.europa.eu/RegData/docs_autres_institutions/commission_europeenne/com/2025/0353/COM_COM(2025)0353_EN.pdf'}, {'text': '', 'href': 'https://eur-lex.europa.eu/smartapi/cgi/sga_doc?smartapi!celexplus!prod!DocNumber&lg=EN&type_doc=COMfinal&an_doc=2025&nu_doc=0353'}], 'Summary': [{'text': 'Summary', 'href': '/oeil/en/document-summary?id=1826596'}]}], '08/09/2025': [{'Date': '08/09/2025', 'Event': 'Committee referral announced in Parliament, 1st reading', 'Reference': '', 'Summary': ''}]}","[{'Institution': 'European Commission', 'Document type': 'Legislative proposal', 'Reference': ""{'text': 'COM(2025)0353', 'href': 'https://www.europarl.europa.eu/RegData/docs_autres_institutions/commission_europeenne/com/2025/0353/COM_COM(2025)0353_EN.pdf'}, {'text': '', 'href': 'https://eur-lex.europa.eu/smartapi/cgi/sga_doc?smartapi!celexplus!prod!DocNumber&lg=EN&type_doc=COMfinal&an_doc=2025&nu_doc=0353'}"", 'Date': '03/07/2025', 'Summary': ""{'text': 'Summary', 'href': '/oeil/en/document-summary?id=1826596'}""}]",,,True,2025/0190(COD),COD - Ordinary legislative procedure (ex-codecision procedure),Codification,Regulation,,Treaty on the Functioning of the EU TFEU 118-p1 Treaty on the Functioning of the EU TFEU 294-p7-ac,Awaiting committee decision,JURI/10/03288,,
89,https://oeil.europarl.europa.eu/oeil/en/procedure-file?reference=2025/0222(COD),2025/0222(COD),Erasmus+ programme 2028–2034,"4.10.13 Sport, 4.40 Education, vocational training and youth","{'European Parliament': [{'Committee responsible': 'CULT Culture and Education', 'Rapporteur': 'ZDROJEWSKI Bogdan Andrzej (EPP)', 'Appointed': '04/11/2025', 'Shadow rapporteurs': ['REPP Sabrina (S&D)', 'VICSEK Annamária (PfE)', 'MAGONI Lara (ECR)', 'FARRENG Laurence (Renew)', 'SCUDERI Benedetta (Greens/EFA)', 'PAPPAS Nikos (The Left)']}, {'Committee for opinion': 'DEVE Development', 'Rapporteur for opinion': '', 'Appointed': ''}, {'Committee for opinion': 'CONT Budgetary Control', 'Rapporteur for opinion': '', 'Appointed': ''}, {'Committee for opinion': 'EMPL Employment and Social Affairs', 'Rapporteur for opinion': 'RIEHL Nela (Greens/EFA)', 'Appointed': '09/12/2025'}, {'Committee for budgetary assessment': 'BUDG Budgets', 'Rapporteur for budgetary assessment': '', 'Appointed': ''}], 'Council of the European Union': [], 'European Commission': [{'Commission DG': 'Education, Youth, Sport and Culture', 'Commissioner': 'MÎNZATU Roxana'}], 'European Economic and Social Committee': [], 'European Committee of the Regions': []}","{'16/07/2025': [{'Date': '16/07/2025', 'Event': 'Legislative proposal published', 'Reference': [{'text': 'COM(2025)0549', 'href': 'https://www.europarl.europa.eu/RegData/docs_autres_institutions/commission_europeenne/com/2025/0549/COM_COM(2025)0549_EN.pdf'}, {'text': '', 'href': 'https://eur-lex.europa.eu/smartapi/cgi/sga_doc?smartapi!celexplus!prod!DocNumber&lg=EN&type_doc=COMfinal&an_doc=2025&nu_doc=0549'}], 'Summary': [{'text': 'Summary', 'href': '/oeil/en/document-summary?id=1830667'}]}], '23/10/2025': [{'Date': '23/10/2025', 'Event': 'Committee referral announced in Parliament, 1st reading', 'Reference': '', 'Summary': ''}]}","[{'Institution': 'European Commission', 'Document type': 'Legislative proposal', 'Reference': ""{'text': 'COM(2025)0549', 'href': 'https://www.europarl.europa.eu/RegData/docs_autres_institutions/commission_europeenne/com/2025/0549/COM_COM(2025)0549_EN.pdf'}, {'text': '', 'href': 'https://eur-lex.europa.eu/smartapi/cgi/sga_doc?smartapi!celexplus!prod!DocNumber&lg=EN&type_doc=COMfinal&an_doc=2025&nu_doc=0549'}"", 'Date': '16/07/2025', 'Summary': ""{'text': 'Summary', 'href': '/oeil/en/document-summary?id=1830667'}""}, {'Institution': 'National parliaments', 'Document type': 'Contribution', 'Parliament/Chamber': 'ES_PARLIAMENT', 'Reference': ""{'text': 'COM(2025)0549', 'href': 'https://connectfolx.europarl.europa.eu/connefof/app/exp/COM(2025)0549'}"", 'Date': '31/10/2025', 'Summary': ''}]","{'Rapporteurs, Shadow Rapporteurs and Committee Chairs': [{'Name': [{'text': 'REPP Sabrina', 'href': 'https://www.europarl.europa.eu/meps/en/256935'}], 'Role': 'Shadow rapporteur', 'Committee': [{'text': 'CULT', 'href': 'https://www.europarl.europa.eu/committes/en/CULT'}], 'Date': '16/12/2025', 'Interest representatives': 'European Olympic Committees EU Office'}, {'Name': [{'text': 'FARRENG Laurence', 'href': 'https://www.europarl.europa.eu/meps/en/197589'}], 'Role': 'Shadow rapporteur', 'Committee': [{'text': 'CULT', 'href': 'https://www.europarl.europa.eu/committes/en/CULT'}], 'Date': '20/11/2025', 'Interest representatives': 'Fédération des associations générales étudiantes (FAGE)'}, {'Name': [{'text': 'REPP Sabrina', 'href': 'https://www.europarl.europa.eu/meps/en/256935'}], 'Role': 'Rapporteur', 'Committee': [{'text': 'CULT', 'href': 'https://www.europarl.europa.eu/committes/en/CULT'}], 'Date': '02/10/2025', 'Interest representatives': 'Fachstelle für Internationale Jugendarbeit der Bundesrepublik Deutschland e.V.'}, {'Name': [{'text': 'VICSEK Annamária', 'href': 'https://www.europarl.europa.eu/meps/en/256859'}], 'Role': 'Shadow rapporteur', 'Committee': [{'text': 'CULT', 'href': 'https://www.europarl.europa.eu/committes/en/CULT'}], 'Date': '01/10/2025', 'Interest representatives': 'Erasmus Student Network Erasmus Student Network Hungary'}, {'Name': [{'text': 'REPP Sabrina', 'href': 'https://www.europarl.europa.eu/meps/en/256935'}], 'Role': 'Shadow rapporteur', 'Committee': [{'text': 'CULT', 'href': 'https://www.europarl.europa.eu/committes/en/CULT'}], 'Date': '02/09/2025', 'Interest representatives': 'Hessisches Ministerium für Wissenschaft und Forschung, Kunst und Kultur'}]}",,True,2025/0222(COD),COD - Ordinary legislative procedure (ex-codecision procedure),Legislation,Regulation,"[{'text': 'Repealing Regulation 2021/817'}, {'text': '2018/0191(COD)', 'href': '/oeil/en/procedure-file?reference=2018/0191(COD)'}, {'text': 'Repealing Regulation 2021/888'}, {'text': '2018/0230(COD)', 'href': '/oeil/en/procedure-file?reference=2018/0230(COD)'}]",Rules of Procedure EP 58 Treaty on the Functioning of the EU TFEU 165-p4 Treaty on the Functioning of the EU TFEU 214-p5 Treaty on the Functioning of the EU TFEU 166-p4,Awaiting committee decision,CULT/10/03658,"[{'text': 'European Economic and Social Committee', 'href': 'http://www.eesc.europa.eu/'}, {'text': 'European Committee of the Regions', 'href': 'http://www.cor.europa.eu/'}]",
